{
  "normalizedName": "Ibmps",
  "type": "免费商用",
  "spdx": "OFL-1.1",
  "licenseUrl": "https://raw.githubusercontent.com/IBM/plex/master/LICENSE.txt",
  "licenseFile": "licenses/Ibmps/LICENSE",
  "commercial": true,
  "modification": true,
  "distribution": true,
  "embedding": true,
  "webUse": true,
  "attribution": false,
  "shareAlike": false,
  "purchaseUrl": null,
  "price": null,
  "notes": "许可原文来自上游 OFL-1.1：https://raw.githubusercontent.com/IBM/plex/master/LICENSE.txt",
  "verified": false,
  "verifiedAt": null,
  "verifiedBy": null,
  "source": "upstream OFL file copied 2026-09-24"
}
