{
  "normalizedName": "Clmb",
  "type": "免费商用",
  "spdx": "OFL-1.1",
  "licenseUrl": "https://github.com/Warren2060/ChillMatrixBlack/blob/main/LICENSE",
  "licenseFile": null,
  "commercial": true,
  "modification": true,
  "distribution": true,
  "embedding": true,
  "webUse": true,
  "attribution": false,
  "shareAlike": false,
  "purchaseUrl": null,
  "price": null,
  "notes": "寒蝉矩黑 Demo 版，授权以上游 README 为准（正式发布后复核）。",
  "verified": false,
  "verifiedAt": null,
  "verifiedBy": null,
  "source": "上游仓授权原文，2026-09-25 随包下载核对"
}
