{
  "normalizedName": "Stfzxfxct",
  "type": "个人免费",
  "spdx": null,
  "licenseUrl": null,
  "licenseFile": "licenses/Stfzxfxct/LICENSE",
  "commercial": false,
  "modification": false,
  "distribution": false,
  "embedding": false,
  "webUse": false,
  "attribution": false,
  "shareAlike": false,
  "purchaseUrl": null,
  "price": null,
  "notes": "仅限个人非商业用途，商业使用需购买授权",
  "verified": false,
  "verifiedAt": null,
  "verifiedBy": null,
  "source": "font-mapping.json (AI 分析)"
}
