{
  "normalizedName": "Zzmk",
  "type": "免费商用",
  "spdx": "OFL-1.1",
  "licenseUrl": "https://github.com/FWHP-Enfun/Star-Love-Font/blob/main/LICENSE.txt",
  "licenseFile": "licenses/Zzmk/LICENSE",
  "commercial": true,
  "modification": true,
  "distribution": true,
  "embedding": true,
  "webUse": true,
  "attribution": false,
  "shareAlike": false,
  "purchaseUrl": null,
  "price": null,
  "notes": "FWHP 以 SIL OFL 1.1 再发布（Star-Love-Font 仓 LICENSE.txt 原文已核对）。原作「天天宅在家」系列（starlove0425，作者声明完全免费使用），版权行保留。",
  "verified": true,
  "verifiedAt": "2026-09-25",
  "verifiedBy": "[CC]",
  "source": "上游仓 LICENSE.txt 随包下载核对"
}
