{
  "normalizedName": "Tbmct",
  "type": "免费商用",
  "spdx": null,
  "licenseUrl": "https://www.alibabafonts.com/#/more",
  "licenseFile": "licenses/Tbmct/LICENSE",
  "commercial": true,
  "modification": null,
  "distribution": null,
  "embedding": null,
  "webUse": null,
  "attribution": null,
  "shareAlike": false,
  "purchaseUrl": null,
  "price": null,
  "notes": "淘宝买菜体授权协议：官方（淘宝买菜 × 通义锦书，fonts.alibabadesign.com / www.alibabafonts.com）声明「现这款字体向所有个人和组织开放，永久免费商用。」发行包内无许可文件，原文为官方页面声明，摘录见 LICENSE。声明未写明修改、再分发、嵌入与商标用途，相应字段不作推断留空。字体 name 表内中文名为「淘宝买菜营销体」，官方产品名「淘宝买菜体」。",
  "verified": false,
  "verifiedAt": null,
  "verifiedBy": null,
  "source": "官方页面声明摘录 2026-09-24，出处 https://www.alibabafonts.com/#/more 与 https://fonts.alibabadesign.com/TaoBaoMaiCaiTi/TaoBaoMaiCaiTi-Regular.zip"
}
