{
  "normalizedName": "Tjlt",
  "type": "免费商用",
  "spdx": "OFL-1.1",
  "licenseUrl": "https://github.com/Buernia/Tiejili/blob/main/LICENSE",
  "licenseFile": "licenses/Tjlt/LICENSE",
  "commercial": true,
  "modification": true,
  "distribution": true,
  "embedding": true,
  "webUse": true,
  "attribution": false,
  "shareAlike": false,
  "purchaseUrl": null,
  "price": null,
  "notes": "SIL OFL 1.1。基于 Fontworks Reggae One（OFL）扩展中文。可商用、可修改、可再分发，不可单独售卖字体文件本体。",
  "verified": true,
  "verifiedAt": "2026-09-25",
  "verifiedBy": "[CC]",
  "source": "上游仓 LICENSE 原文，2026-09-25 随包下载核对"
}
