{
  "normalizedName": "Cldin",
  "type": "免费商用",
  "spdx": "OFL-1.1",
  "licenseUrl": "https://github.com/Warren2060/ChillDIN-ChillDINGothic/blob/main/LICENSE",
  "licenseFile": null,
  "commercial": true,
  "modification": true,
  "distribution": true,
  "embedding": true,
  "webUse": true,
  "attribution": false,
  "shareAlike": false,
  "purchaseUrl": null,
  "price": null,
  "notes": "SIL OFL 1.1，原文随上游仓携带并核对（寒蝉字型系列惯例）。",
  "verified": true,
  "verifiedAt": "2026-09-25",
  "verifiedBy": "[CC]",
  "source": "上游仓授权原文，2026-09-25 随包下载核对"
}
