{
  "normalizedName": "Mkkzs",
  "type": "免费商用",
  "spdx": "OFL-1.1",
  "licenseUrl": "https://github.com/maoken-fonts/maoken-heavy-labourer/blob/main/LICENSE.txt",
  "licenseFile": "licenses/Mkkzs/LICENSE",
  "commercial": true,
  "modification": true,
  "distribution": true,
  "embedding": true,
  "webUse": true,
  "attribution": false,
  "shareAlike": false,
  "purchaseUrl": null,
  "price": null,
  "notes": "SIL OFL 1.1，猫啃网对思源宋体 CN Heavy 加重再制后重新发布（Adobe 保留字体名 Source）。可商用、可修改、可再分发，不可单独售卖字体文件本体。",
  "verified": true,
  "verifiedAt": "2026-09-24",
  "verifiedBy": "[CC]",
  "source": "上游仓 OFL.txt 英文原文，2026-09-24 随包下载核对"
}
