{
  "normalizedName": "Zkwyt",
  "type": "免费商用",
  "spdx": null,
  "licenseUrl": "https://www.zcool.com.cn/special/zcoolfonts/",
  "licenseFile": "licenses/Zkwyt/LICENSE",
  "commercial": true,
  "modification": false,
  "distribution": true,
  "embedding": true,
  "webUse": true,
  "attribution": false,
  "shareAlike": false,
  "purchaseUrl": null,
  "price": null,
  "notes": "站酷官方免费授权：永久免费授权全社会使用（含商用）；禁止修改字体名称、禁止转售。",
  "verified": true,
  "verifiedAt": "2026-09-26",
  "verifiedBy": "zcool 官方字库页/Google Fonts",
  "source": "https://www.zcool.com.cn/special/zcoolfonts/"
}