{
  "normalizedName": "Bb7",
  "type": "免费商用",
  "spdx": "OFL-1.1",
  "licenseUrl": "https://github.com/scott0107000/BoutiqueBitmap7x7/blob/main/LICENSE",
  "licenseFile": null,
  "commercial": true,
  "modification": true,
  "distribution": true,
  "embedding": true,
  "webUse": true,
  "attribution": false,
  "shareAlike": false,
  "purchaseUrl": null,
  "price": null,
  "notes": "SIL OFL 1.1，原文随上游仓携带并核对。可商用、可修改、可再分发，衍生须改用新名，禁止单独售卖字体文件。",
  "verified": true,
  "verifiedAt": "2026-09-25",
  "verifiedBy": "[CC]",
  "source": "上游仓授权原文，2026-09-25 随包下载核对"
}
