{
  "normalizedName": "Scjskkt",
  "type": "免费商用",
  "spdx": null,
  "licenseUrl": "https://www.sucaijishi.com",
  "commercial": true,
  "modification": false,
  "distribution": true,
  "embedding": true,
  "webUse": true,
  "attribution": false,
  "shareAlike": false,
  "notes": "平台出品字体，授权依据=平台官方免费商用声明（素材平台真出品，集群记忆 #8626 口径：平台出品非冒名）。原字体包未附授权文件，以平台页公示为准。",
  "verified": true,
  "verifiedAt": "2026-09-26",
  "verifiedBy": "平台官方免费商用声明页",
  "source": "https://www.sucaijishi.com"
}