{
  "normalizedName": "Mkybkjs",
  "type": "免费商用",
  "spdx": "OFL-1.1",
  "licenseUrl": "https://github.com/maoken-fonts/MaokenYingBiKaiShuJ/blob/main/OFL.txt",
  "licenseFile": "licenses/Mkybkjs/LICENSE",
  "commercial": true,
  "modification": true,
  "distribution": true,
  "embedding": true,
  "webUse": true,
  "attribution": false,
  "shareAlike": false,
  "purchaseUrl": null,
  "price": null,
  "notes": "SIL OFL 1.1（Copyright 2025 Luke036 及贡献者 ZERO子），基于随峰体 Plus 改作。可商用、可修改、可再分发，不可单独售卖字体文件本体。",
  "verified": true,
  "verifiedAt": "2026-09-24",
  "verifiedBy": "[CC]",
  "source": "上游仓 OFL.txt 英文原文，2026-09-24 随包下载核对"
}
